{
  "id": "01K6B2Z0R3P0S1T2V3W4X5Y6Z8",
  "source": "local",
  "name": "billing",
  "github": null,
  "local": {
    "directory": "billing"
  },
  "defaultBranch": "main",
  "access": "active",
  "sync": {
    "state": "idle",
    "lastFetchedAt": "2026-09-29T07:31:05Z",
    "lastError": null,
    "defaultBranchHead": "c0ffee0123456789abcdef0123456789abcdef01"
  },
  "openReviewCount": 1,
  "createdAt": "2026-09-29T06:58:00Z"
}
